{
  "dcp_version": "2.0",
  "agent_id": "agent:research-bot-v2-001",
  "session_nonce": "a1b2c3d4e5f6a1b2c3d4e5f6a1b2c3d4e5f6a1b2c3d4e5f6a1b2c3d4e5f6a1b2",
  "timestamp": "2026-02-01T12:00:00Z",
  "vitality_score": 870,
  "state": "active",
  "metrics": {
    "task_completion_rate": 0.94,
    "error_rate": 0.03,
    "human_satisfaction": 0.91,
    "policy_alignment": 0.98
  },
  "prev_report_hash": "genesis",
  "composite_sig": {
    "classical": { "alg": "ed25519", "kid": "a1b2c3d4e5f6a1b2c3d4e5f6a1b2c3d4", "sig_b64": "dGVzdHNpZzEyMzQ1Njc4OTAxMjM0NTY=" },
    "pq": { "alg": "ml-dsa-65", "kid": "d4e5f6a1b2c3d4e5f6a1b2c3d4e5f6a1", "sig_b64": "dGVzdHBxc2lnMTIzNDU2Nzg5MDEyMzQ1Ng==" },
    "binding": "pq_over_classical"
  }
}
